{
  "version": 1,
  "outcome": "rows",
  "columns": [
    "id"
  ],
  "rows": [
    [
      "vid001"
    ],
    [
      "vid002"
    ],
    [
      "vid003"
    ],
    [
      "vid004"
    ],
    [
      "vid005"
    ],
    [
      "vid006"
    ],
    [
      "vid007"
    ],
    [
      "vid008"
    ],
    [
      "vid009"
    ],
    [
      "vid010"
    ]
  ]
}
